{
  "schema_version": "0.1.0",
  "id": "openssh-CVE-2021-28041",
  "project": "openssh",
  "title": "Advisory-linked fix reference for CVE-2021-28041 in openssh",
  "status": "unknown",
  "nodes": [
    {
      "id": "cve:CVE-2021-28041",
      "type": "advisory",
      "label": "CVE-2021-28041",
      "attributes": {
        "cwe": null,
        "cwe_state": "UNKNOWN"
      }
    },
    {
      "id": "commit:e04fd6dde16de1cdc5a4d9946397ff60d96568db",
      "type": "commit",
      "label": "Fix commit e04fd6dde16d",
      "attributes": {
        "sha": "e04fd6dde16de1cdc5a4d9946397ff60d96568db",
        "committed_at": "2021-02-17T04:03:41Z",
        "repository": "openssh/openssh-portable",
        "url": "https://github.com/openssh/openssh-portable/commit/e04fd6dde16de1cdc5a4d9946397ff60d96568db",
        "source_advisory_time": null,
        "source_advisory_time_kind": "unknown"
      }
    },
    {
      "id": "pattern:memory-lifetime",
      "type": "pattern",
      "label": "Recorded pattern family (analyst hypothesis)",
      "attributes": {
        "family": "memory-lifetime",
        "status": "hypothesis"
      }
    }
  ],
  "edges": [
    {
      "id": "edge-fixed-by",
      "source": "cve:CVE-2021-28041",
      "target": "commit:e04fd6dde16de1cdc5a4d9946397ff60d96568db",
      "relation": "fixed_by",
      "status": "observed",
      "evidence_ids": [
        "e-study",
        "e-commit-meta"
      ],
      "known_at": "2026-10-08T00:00:00Z"
    },
    {
      "id": "edge-pattern-family",
      "source": "pattern:memory-lifetime",
      "target": "cve:CVE-2021-28041",
      "relation": "affects",
      "status": "hypothesis",
      "evidence_ids": [
        "e-study"
      ],
      "known_at": "2026-10-08T00:00:00Z"
    }
  ],
  "evidence": [
    {
      "id": "e-commit",
      "url": "https://api.osv.dev/v1/vulns/CVE-2021-28041",
      "fetch_url": "https://api.osv.dev/v1/vulns/CVE-2021-28041",
      "observed_at": "2026-10-08T00:00:00Z",
      "sha256": "af1a598c37ed1a1a60040922d4119fc25e65731ae85c88828d6bf3a07c9802da",
      "hash_scope": "sha256 over the canonical JSON of the OSV advisory object at https://api.osv.dev/v1/vulns/<advisory id>, as recorded by the upstream study; commit content is not covered",
      "source_license": "OSV advisory metadata fetched by the upstream study from api.osv.dev; dataset terms are not recorded by the source study",
      "extractor": "fable-2026-06 slice; scripts/studies/fetch_openssh.py",
      "canonicalization": "upstream study canonicalization json.dumps(osv_vulnerability, sort_keys=True) encoded UTF-8; the advisory JSON is not stored in this pack, so the converter does not recompute it"
    },
    {
      "id": "e-study",
      "url": "https://github.com/iberi22/kernel-security-memory/blob/main/docs/studies/fable-2026-06/openssh/records/openssh-CVE-2021-28041.json",
      "fetch_url": "https://raw.githubusercontent.com/iberi22/kernel-security-memory/main/docs/studies/fable-2026-06/openssh/records/openssh-CVE-2021-28041.json",
      "observed_at": "2026-10-08T00:00:00Z",
      "sha256": "b1eb5bd3b224ae46578c8430b1084893e6c8ebf6a991547a55af3ed1c70a3a3f",
      "hash_scope": "bytes of docs/studies/fable-2026-06/openssh/records/openssh-CVE-2021-28041.json in this repository at conversion time",
      "source_license": "MIT (this repository); referenced upstream content keeps its own terms",
      "extractor": "scripts/convert_fable_records.py",
      "canonicalization": "raw bytes, no transformation; the URL uses the mutable main alias for discovery while the digest pins the bytes read at conversion time"
    },
    {
      "id": "e-commit-meta",
      "url": "https://api.github.com/repos/openssh/openssh-portable/commits/e04fd6dde16de1cdc5a4d9946397ff60d96568db",
      "fetch_url": "https://api.github.com/repos/openssh/openssh-portable/commits/e04fd6dde16de1cdc5a4d9946397ff60d96568db",
      "observed_at": "2026-10-10T01:00:39Z",
      "sha256": "91e542ac9858f17ee026afaf9409e13b632f33840d4eef5a6bd5bb16133df0b0",
      "hash_scope": "sha256 over the canonical JSON line cached in docs/studies/fable-2026-06/commit-meta.jsonl for this commit (repo, sha, committer_date, author_date, parents, files_changed, api_url, fetched_at); it covers the cached metadata, not the commit tree or the patch",
      "source_license": "GitHub REST API commit metadata; the commit keeps its upstream license",
      "extractor": "scripts/convert_fable_records.py --fetch-commit-meta",
      "canonicalization": "json.dumps(row, sort_keys=True, separators=(\",\", \":\")) encoded UTF-8 over the cached line, excluding its newline"
    }
  ],
  "claims": [
    {
      "id": "claim-fix-link",
      "status": "observed",
      "text": "The cited source record associates CVE-2021-28041 with fix commit e04fd6dde16de1cdc5a4d9946397ff60d96568db in openssh/openssh-portable.",
      "evidence_ids": [
        "e-study",
        "e-commit"
      ]
    },
    {
      "id": "claim-digest-scope",
      "status": "observed",
      "text": "The digest recorded for the fix reference covers the advisory JSON fetched by the upstream study from https://api.osv.dev/v1/vulns/CVE-2021-28041, not the commit content; the advisory JSON is not stored in this pack.",
      "evidence_ids": [
        "e-commit"
      ]
    },
    {
      "id": "claim-pattern-family",
      "status": "hypothesis",
      "text": "The pattern-family classification recorded by the cited source study is an analyst hypothesis and was not verified against the fix content.",
      "evidence_ids": [
        "e-study"
      ]
    },
    {
      "id": "claim-cwe",
      "status": "observed",
      "text": "The cited source record states no CWE classification for CVE-2021-28041 (source cwe_state: UNKNOWN).",
      "evidence_ids": [
        "e-study"
      ]
    }
  ],
  "evolution": {
    "outcome": "UNKNOWN",
    "coverage": "NOT_SCANNED",
    "horizon_end": null,
    "followups": []
  },
  "validation": {
    "method": "Converted offline from the cited fable-2026-06 study record and from the cached docs/studies/fable-2026-06/commit-meta.jsonl; no network fetch and no fix-content inspection. Advisory/fix association, digest provenance, pattern family and CWE state are restated from the source record. committed_at is the GitHub API committer date when commit meta is cached for the commit and is otherwise null, with the upstream advisory timestamp kept as source_advisory_time plus its kind.",
    "pair_content_verified": false,
    "security_effectiveness": "UNKNOWN",
    "digest_reproducible_from_url": false,
    "source_record": "docs/studies/fable-2026-06/openssh/records/openssh-CVE-2021-28041.json"
  },
  "license": {
    "code_redistributed": false,
    "original_annotations": "MIT"
  }
}
