{
  "schema_version": "0.1.0",
  "id": "git-CVE-2020-11008",
  "project": "git",
  "title": "Advisory-linked fix reference for CVE-2020-11008 in git",
  "status": "unknown",
  "nodes": [
    {
      "id": "cve:CVE-2020-11008",
      "type": "advisory",
      "label": "CVE-2020-11008",
      "attributes": {
        "cwe": null,
        "cwe_state": "UNKNOWN"
      }
    },
    {
      "id": "commit:c44088ecc4b0722636e0a305f9608d3047197282",
      "type": "commit",
      "label": "Fix commit c44088ecc4b0",
      "attributes": {
        "sha": "c44088ecc4b0722636e0a305f9608d3047197282",
        "committed_at": "2020-04-19T23:10:58Z",
        "repository": "git/git",
        "url": "https://github.com/git/git/commit/c44088ecc4b0722636e0a305f9608d3047197282",
        "source_advisory_time": "2026-08-07T15:11:31.755469Z",
        "source_advisory_time_kind": "osv_modified"
      }
    },
    {
      "id": "pattern:logic",
      "type": "pattern",
      "label": "Recorded pattern family (analyst hypothesis)",
      "attributes": {
        "family": "logic",
        "status": "hypothesis"
      }
    }
  ],
  "edges": [
    {
      "id": "edge-fixed-by",
      "source": "cve:CVE-2020-11008",
      "target": "commit:c44088ecc4b0722636e0a305f9608d3047197282",
      "relation": "fixed_by",
      "status": "observed",
      "evidence_ids": [
        "e-study",
        "e-commit-meta"
      ],
      "known_at": "2026-10-08T18:32:29Z"
    },
    {
      "id": "edge-pattern-family",
      "source": "pattern:logic",
      "target": "cve:CVE-2020-11008",
      "relation": "affects",
      "status": "hypothesis",
      "evidence_ids": [
        "e-study"
      ],
      "known_at": "2026-10-08T18:32:29Z"
    }
  ],
  "evidence": [
    {
      "id": "e-commit",
      "url": "https://api.osv.dev/v1/vulns/CVE-2020-11008",
      "fetch_url": "https://api.osv.dev/v1/vulns/CVE-2020-11008",
      "observed_at": "2026-10-08T18:32:29Z",
      "sha256": "2287c6905596eabf46294f208a25634b68d58dfb40ac5b001c1b9b38df2514fa",
      "hash_scope": "sha256 over the canonical JSON of the OSV advisory object at https://api.osv.dev/v1/vulns/<advisory id>, as recorded by the upstream study; commit content is not covered",
      "source_license": "OSV advisory metadata fetched by the upstream study from api.osv.dev; dataset terms are not recorded by the source study",
      "extractor": "fable-2026-06 slice; scripts/studies/fetch_git.py",
      "canonicalization": "upstream study canonicalization json.dumps(osv_vulnerability, sort_keys=True) encoded UTF-8; the advisory JSON is not stored in this pack, so the converter does not recompute it"
    },
    {
      "id": "e-study",
      "url": "https://github.com/iberi22/kernel-security-memory/blob/main/docs/studies/fable-2026-06/git/records/cve-2020-11008.json",
      "fetch_url": "https://raw.githubusercontent.com/iberi22/kernel-security-memory/main/docs/studies/fable-2026-06/git/records/cve-2020-11008.json",
      "observed_at": "2026-10-08T18:32:29Z",
      "sha256": "b47a48634e9f53b6617f7d71ade6a1aa3b5c50d81aef1ee87d48aebcb9903379",
      "hash_scope": "bytes of docs/studies/fable-2026-06/git/records/cve-2020-11008.json in this repository at conversion time",
      "source_license": "MIT (this repository); referenced upstream content keeps its own terms",
      "extractor": "scripts/convert_fable_records.py",
      "canonicalization": "raw bytes, no transformation; the URL uses the mutable main alias for discovery while the digest pins the bytes read at conversion time"
    },
    {
      "id": "e-commit-meta",
      "url": "https://api.github.com/repos/git/git/commits/c44088ecc4b0722636e0a305f9608d3047197282",
      "fetch_url": "https://api.github.com/repos/git/git/commits/c44088ecc4b0722636e0a305f9608d3047197282",
      "observed_at": "2026-10-10T01:00:32Z",
      "sha256": "f66a61fd22ecded4be96c13ba7900beec075e77b07c5763ab8bfb7d23d543985",
      "hash_scope": "sha256 over the canonical JSON line cached in docs/studies/fable-2026-06/commit-meta.jsonl for this commit (repo, sha, committer_date, author_date, parents, files_changed, api_url, fetched_at); it covers the cached metadata, not the commit tree or the patch",
      "source_license": "GitHub REST API commit metadata; the commit keeps its upstream license",
      "extractor": "scripts/convert_fable_records.py --fetch-commit-meta",
      "canonicalization": "json.dumps(row, sort_keys=True, separators=(\",\", \":\")) encoded UTF-8 over the cached line, excluding its newline"
    }
  ],
  "claims": [
    {
      "id": "claim-fix-link",
      "status": "observed",
      "text": "The cited source record associates CVE-2020-11008 with fix commit c44088ecc4b0722636e0a305f9608d3047197282 in git/git.",
      "evidence_ids": [
        "e-study",
        "e-commit"
      ]
    },
    {
      "id": "claim-digest-scope",
      "status": "observed",
      "text": "The digest recorded for the fix reference covers the advisory JSON fetched by the upstream study from https://api.osv.dev/v1/vulns/CVE-2020-11008, not the commit content; the advisory JSON is not stored in this pack.",
      "evidence_ids": [
        "e-commit"
      ]
    },
    {
      "id": "claim-pattern-family",
      "status": "hypothesis",
      "text": "The pattern-family classification recorded by the cited source study is an analyst hypothesis and was not verified against the fix content.",
      "evidence_ids": [
        "e-study"
      ]
    },
    {
      "id": "claim-cwe",
      "status": "observed",
      "text": "The cited source record states no CWE classification for CVE-2020-11008 (source cwe_state: UNKNOWN).",
      "evidence_ids": [
        "e-study"
      ]
    }
  ],
  "evolution": {
    "outcome": "UNKNOWN",
    "coverage": "NOT_SCANNED",
    "horizon_end": null,
    "followups": []
  },
  "validation": {
    "method": "Converted offline from the cited fable-2026-06 study record and from the cached docs/studies/fable-2026-06/commit-meta.jsonl; no network fetch and no fix-content inspection. Advisory/fix association, digest provenance, pattern family and CWE state are restated from the source record. committed_at is the GitHub API committer date when commit meta is cached for the commit and is otherwise null, with the upstream advisory timestamp kept as source_advisory_time plus its kind.",
    "pair_content_verified": false,
    "security_effectiveness": "UNKNOWN",
    "digest_reproducible_from_url": false,
    "source_record": "docs/studies/fable-2026-06/git/records/cve-2020-11008.json"
  },
  "license": {
    "code_redistributed": false,
    "original_annotations": "MIT"
  }
}
